icsad_ID,Original_Release_Date,Last_Updated,Year,ICS-CERT_Number,ICS-CERT_Advisory_Title,Vendor,Product,Products_Affected,CVE_Number,Cumulative_CVSS,CVSS_Severity,CWE_Number,Critical_Infrastructure_Sector,Product_Distribution,Company_Headquarters
1229,12/19/2019,No Updates,2019,ICSMA-19-353-01,"Philips Veradius Unity, Pulsera, and Endura Dual WAN Routers",Philips,"Veradius Unity, Pulsera, and Endura Dual WAN Routers","Veradius Unity, Pulsera, and Endura Dual WAN Routers are affected: Veradius Unity (718132) with wireless option (shipped between 2016-August 2018) Veradius Unity (718132) with ViewForum option (shipped between 2016-August 2018) Pulsera (718095) and Endura (718075) with wireless option (shipped between 26-June-2017 through 07-August 2018) Pulsera (718095) and Endura (718075) with ViewForum option (shipped between 26-June-2017 through 07-August 2018)",CVE-2019-18263,5.3,Medium,CWE-326,Healthcare and Public Health,Worldwide,Netherlands
1228,12/19/2019,No Updates,2019,ICSA-19-353-01,Moxa EDS Ethernet Switches,Moxa,EDS Ethernet Switches,EDS-G508E Series: Firmware Version 6.0 and prior EDS-G512E Series: Firmware Version 6.0 and prior EDS-G516E Series: Firmware Version 6.0 and prior.,CVE-2019-19707,7.5,High,CWE-400,Critical Manufacturing; Energy; Water and Wastewater,Worldwide,Taiwan
1227,12/19/2019,No Updates,2019,ICSA-19-353-02,Equinox Control Expert,Equinox,Control Expert,"Control Expert, all current and older versions could be affected.",CVE-2019-18234,9.8,Critical,CWE-89,Multiple Critical Sectors,Argentina Uruguay,Argentina
1226,12/19/2019,No Updates,2019,ICSA-19-353-03,WECON PLC Editor,WECON,PLC Editor,"Version of PLC Editor, a ladder logic software, is reported to be affected: Version 1.3.5_20190129.",CVE-2019-18236,7.8,High,CWE-121,Critical Manufacturing; Energy; Water and Wastewater,Worldwide,China
1225,12/19/2019,No Updates,2019,ICSA-19-353-04,Reliable Controls MACH-ProWebCom/Sys,Reliable Controls,MACH-ProWebCom/Sys,MACH-ProWebSys: All versions prior to 2.15 (Firmware versions prior to 8.26.4) MACH-ProWebCom: All versions prior to 2.15 (Firmware versions prior to 8.26.4).,CVE-2019-18249,8.2,High,CWE-79,Commercial Facilities,Worldwide,Canada
1224,12/19/2019,No Updates,2019,ICSA-19-318-04,Omron CX-Supervisor (Update A),Omron,CX-Supervisor,Versions of both “Full Development” and “Runtime Only” packages of Omron’s SCADA and HMI package CX-Supervisor are affected: CX-Supervisor Versions 3.5 (12) and prior.,CVE-2019-18251,8.8,High,CWE-477,Energy,Worldwide,Japan
1223,12/19/2019,No Updates,2019,ICSA-19-290-01,AVEVA Vijeo Citect and Citect SCADA (Update A),"AVEVA, Schneider Electric",Vijeo Citect and Citect SCADA,Versions of the IEC870IP driver used in AVEVA’s Vijeo Citect and Citect SCADA and Schneider Electric’s Power SCADA Operation are affected: IEC870IP driver v4.14.02 and prior.,CVE-2019-13537,7.5,High,CWE-121,Energy,Worldwide,France
1222,12/17/2019,No Updates,2019,ICSA-19-351-01,GE S2020/S2020G Fast Switch 61850,GE,S2020/S2020G Fast Switch 61850,"GE S2020/S2020G Fast Switch 61850, a managed Ethernet switch version affected: Versions 07A03 and prior.",CVE-2019-18267,4.6,Medium,CWE-79,Critical Manufacturing; Energy; Transportation,Worldwide,United States
1221,12/12/2019,No Updates,2019,ICSA-19-346-01,Advantech DiagAnywhere Server,Advantech,DiagAnywhere Server,DiagAnywhere Server Versions 3.07.11 and prior.,CVE-2019-18257,9.8,Critical,CWE-121,Critical Manufacturing; Energy; Water and Wastewater,East Asia United States and Europe,Taiwan
1220,12/12/2019,4/18/2023,2019,ICSA-19-346-02,Omron PLC CJ and CS Series (Update B),Omron,PLC CJ and CS Series,"The following versions of Omron Programmable Logic Controllers are affected: Omron PLC CJ series, all versions Omron PLC CS series, all versions Omron PLC NX1P2 series, all versions.","CVE-2019-18259
CVE-2019-13533
CVE-2019-18269",8.6,High,"CWE-290
CWE-294
CWE-412",Critical Manufacturing,Worldwide,Japan
1219,12/12/2019,No Updates,2019,ICSA-19-346-03,"Omron PLC CJ, CS and NJ Series",Omron,"PLC CJ, CS and NJ Series","Omron PLC CS series, all versions Omron PLC CJ series, all versions Omron PLC NJ series, all versions",CVE-2019-18261,6.5,Medium,CWE-307,Critical Manufacturing,Worldwide,Japan
1218,12/12/2019,No Updates,2019,ICSMA-19-318-01,Philips IntelliBridge EC40/80 (Update A),Philips,IntelliBridge EC40/80,"IntelliBridge EC40 Hub, all versions IntelliBridge EC80 Hub, all versions.",CVE-2019-18241,6.3,Medium,CWE-326,Healthcare and Public Health,Worldwide,Netherlands
1217,12/12/2019,12/17/2019,2019,ICSA-19-106-03,PLC Cycle Time Influences (Update A),ABB,PLC Cycle Time Influences,ABB 1SAP120600R0071 PM554-TP-ETH,CVE-2019-10953,7.5,High,CWE-400,Chemical; Commercial Facilities; Critical Manufacturing; Dams; Energy; Food and Agriculture; Transportation; Water and Wastewater,Worldwide,Switzerland
1216,12/12/2019,12/17/2019,2019,ICSA-19-106-03,PLC Cycle Time Influences (Update A),PHOENIX CONTACT,PLC Cycle Time Influences,Phoenix Contact 2700974 ILC 151 ETH | Phoenix Contact ILC 191 ETH 2TX,CVE-2019-10953,7.5,High,CWE-400,Chemical; Commercial Facilities; Critical Manufacturing; Dams; Energy; Food and Agriculture; Transportation; Water and Wastewater,Worldwide,Germany
1215,12/12/2019,12/17/2019,2019,ICSA-19-106-03,PLC Cycle Time Influences (Update A),Schneider Electric,PLC Cycle Time Influences,Schneider Modicon M221,CVE-2019-10953,7.5,High,CWE-400,Chemical; Commercial Facilities; Critical Manufacturing; Dams; Energy; Food and Agriculture; Transportation; Water and Wastewater,Worldwide,France
1214,12/12/2019,12/17/2019,2019,ICSA-19-106-03,PLC Cycle Time Influences (Update A),Siemens,PLC Cycle Time Influences,Siemens 6ES7211-1AE40-0XB0 Simatic S7-1211 | Siemens 6ES7314-6EH04-0AB0 Simatic S7-314 | Siemens 6ED1052-1CC01-0BA8 Logo! 8,CVE-2019-10953,7.5,High,CWE-400,Chemical; Commercial Facilities; Critical Manufacturing; Dams; Energy; Food and Agriculture; Transportation; Water and Wastewater,Worldwide,Germany
1213,12/12/2019,12/17/2019,2019,ICSA-19-106-03,PLC Cycle Time Influences (Update A),WAGO,PLC Cycle Time Influences,WAGO 750-889 Controller KNX IP | WAGO 750-8100 Controller PFC100 | WAGO 750-880 Controller ETH | WAGO 750-831 Controller BACnet/IP,CVE-2019-10953,7.5,High,CWE-400,Chemical; Commercial Facilities; Critical Manufacturing; Dams; Energy; Food and Agriculture; Transportation; Water and Wastewater,Worldwide,Germany
1212,12/10/2019,No Updates,2019,ICSA-19-344-01,Siemens SCALANCE W700 and W1700,Siemens,SCALANCE W700 and W1700,"SCALANCE W700 and W1700, wireless communication devices, are affected: SCALANCE W700 Versions 6.3 and prior.",CVE-2018-14526,6.5,Medium,CWE-924,Chemical; Critical Manufacturing; Energy; Food and Agriculture; Water and Wastewater,Worldwide,Germany
1211,12/10/2019,9/15/2022,2019,ICSA-19-344-03,Siemens RUGGEDCOM ROS (Update A),Siemens,RUGGEDCOM ROS,"--------- Begin Update A Part 1 of 2 ---------
The following versions of RUGGEDCOM ROS, an ethernet switch, are affected:
RUGGEDCOM ROS RMC8388: All versions with U-Boot prior to V2016.05RS09 (only affected by CVE-2018-18440)
RUGGEDCOM ROS RSG900C: All versions with U-Boot prior to V2016.05RS09 (only affected by CVE-2018-18440)
RUGGEDCOM ROS RSG900R: All versions with U-Boot prior to V2016.05RS09 (only affected by CVE-2018-18440)
RUGGEDCOM ROS RSG907R: All versions with U-Boot prior to V2016.05RS09 (only affected by CVE-2018-18440)
RUGGEDCOM ROS RSG908C: All versions with U-Boot prior to V2016.05RS09 (only affected by CVE-2018-18440)
RUGGEDCOM ROS RSG909R: All versions with U-Boot prior to V2016.05RS09 (only affected by CVE-2018-18440)
RUGGEDCOM ROS RSG910C: All versions with U-Boot prior to V2016.05RS09 (only affected by CVE-2018-18440)
RUGGEDCOM ROS RSG920P: Versions 2016.05RS09 and later (only affected by CVE-2019-13103)
RUGGEDCOM ROS RSG920P: All versions with U-Boot prior to V2016.05RS09
RUGGEDCOM ROS RSG2488: Versions 2016.05RS09 and later (only affected by CVE-2019-13103)
RUGGEDCOM ROS RSG2488: All versions with U-Boot prior to V2016.05RS09
RUGGEDCOM ROS RSL910: All versions with U-Boot prior to V2016.05RS09 (only affected by CVE-2018-18440)
RUGGEDCOM ROS RST2228: Versions 2016.05RS09 and later (only affected by CVE-2019-13103)
RUGGEDCOM ROS RST2228: All versions with U-Boot prior to V2016.05RS09
--------- End Update A Part 1 of 2 ---------.","CVE-2018-18440
CVE-2019-13103",7.8,High,"CWE-119
CWE-399",Energy; Healthcare and Public Health; Transportation,Worldwide,Germany
1210,12/10/2019,No Updates,2019,ICSA-19-344-05,Siemens XHQ Operations Intelligence,Siemens,XHQ Operations Intelligence,Siemens Operations Intelligence products: XHQ: All versions prior to v6.0.0.2.,CVE-2019-13930; CVE-2019-13931; CVE-2019-13932,8.8,High,CWE-352; CWE-20; CWE-80,Energy,Worldwide,Germany
1209,12/10/2019,No Updates,2019,ICSA-16-327-02,Siemens SIMATIC CP 343-1/CP 443-1 Modules and SIMATIC S7-300/S7-400 CPUs Vulnerabilities (Update B),Siemens,SIMATIC CP 343-1/CP 443-1 Modules and SIMATIC S7-300/S7-400 CPUs  ,SIMATIC CP 343-1 Advanced (incl. SIPLUS NET variant):  All versions prior to v3.0.53 SIMATIC CP 443-1 Advanced (incl. SIPLUS NET variant):  All versions prior to v3.2.17 SIMATIC S7-300 CPU family (incl. SIPLUS NET variant):  All firmware versions SIMATIC S7-400 CPU family (incl. SIPLUS NET variant):  All firmware versions.,CVE-2016-8673; CVE-2016-8672,6.3,Medium,CWE-345; CWE-614,Chemical; Critical Manufacturing; Food and Agriculture,Worldwide,Germany
1208,12/10/2019,No Updates,2019,ICSA-13-149-01,Siemens SCALANCE Privilege Escalation Vulnerabilities (Update A),Siemens,SCALANCE,SCALANCE: SCALANCE X-200 switch family (incl. SIPLUS NET variants): versions prior to v4.5.0 SCALANCE X-200IRT switch family (incl. SIPLUS NET variants): versions prior to v5.1.0.,CVE-2013-3633; CVE-2013-3634,7.6,High,CWE-287; CWE-264,Chemical; Communications; Critical Manufacturing; Dams; Defense Industrial Base; Energy; Food and Agriculture; Government Facilities; Transportation Systems: Water and Wastewater,Germany Worldwide,Germany
1207,12/5/2019,No Updates,2019,ICSA-19-339-01,Thales DIS SafeNet Sentinel LDK License Manager Runtime,Thales DIS,SafeNet Sentinel LDK License Manager Runtime,"SafeNet Sentinel LDK License Manager, all versions prior to 7.101(only Microsoft Windows versions are affected).",CVE-2019-18232,7.3,High,CWE-59,Multiple Critical Sectors,Worldwide,France
1206,12/5/2019,No Updates,2019,ICSA-19-339-02,Weidmueller Industrial Ethernet Switches,Weidmueller,Industrial Ethernet Switches,The following versions of industrial Ethernet switches are affected: IE-SW-VL05M-5TX firmware v3.6.6 Build 16102415 and prior IE-SW-VL05MT-5TX firmware v3.6.6 Build 16102415 and prior IE-SW-VL05M-3TX-2SC firmware v3.6.6 Build 16102415 and prior IE-SW-VL05MT-3TX-2SC firmware v3.6.6 Build 16102415 and prior IE-SW-VL05M-3TX-2ST firmware v3.6.6 Build 16102415 and prior IE-SW-VL05MT-3TX-2ST firmware v3.6.6 Build 16102415 and prior IE-SW-VL08MT-8TX firmware v3.5.2 Build 16102415 and prior IE-SW-VL08MT-5TX-3SC firmware v3.5.2 Build 16102415 and prior IE-SW-VL08MT-5TX-1SC-2SCS firmware v3.5.2 Build 16102415 and prior IE-SW-VL08MT-6TX-2ST firmware v3.5.2 Build 16102415 and prior IE-SW-VL08MT-6TX-2SC firmware v3.5.2 Build 16102415 and prior IE-SW-VL08MT-6TX-2SCS firmware v3.5.2 Build 16102415 and prior IE-SW-PL08M-8TX firmware v3.3.8 Build 16102416 and prior IE-SW-PL08MT-8TX firmware v3.3.8 Build 16102416 and prior IE-SW-PL08M-6TX-2SC firmware v3.3.8 Build 16102416 and prior IE-SW-PL08MT-6TX-2SC firmware v3.3.8 Build 16102416 and prior IE-SW-PL08M-6TX-2ST firmware v3.3.8 Build 16102416 and prior IE-SW-PL08MT-6TX-2ST firmware v3.3.8 Build 16102416 and prior IE-SW-PL08M-6TX-2SCS firmware v3.3.8 Build 16102416 and prior IE-SW-PL08MT-6TX-2SCS firmware v3.3.8 Build 16102416 and prior IE-SW-PL10M-3GT-7TX firmware v3.3.16 Build 16102416 and prior IE-SW-PL10MT-3GT-7TX firmware v3.3.16 Build 16102416 and prior IE-SW-PL10M-1GT-2GS-7TX firmware v3.3.16 Build 16102416 and prior IE-SW-PL10MT-1GT-2GS-7TX firmware v3.3.16 Build 16102416 and prior IE-SW-PL16M-16TX firmware v3.4.2 Build 16102416 and prior IE-SW-PL16MT-16TX firmware v3.4.2 Build 16102416 and prior IE-SW-PL16M-14TX-2SC firmware v3.4.2 Build 16102416 and prior IE-SW-PL16MT-14TX-2SC firmware v3.4.2 Build 16102416 and prior IE-SW-PL16M-14TX-2ST firmware v3.4.2 Build 16102416 and prior IE-SW-PL16MT-14TX-2ST firmware v3.4.2 Build 16102416 and prior IE-SW-PL18M-2GC-16TX firmware v3.4.4 Build 16102416 and prior IE-SW-PL18MT-2GC-16TX firmware v3.4.4 Build 16102416 and prior IE-SW-PL18M-2GC14TX2SC firmware v3.4.4 Build 16102416 and prior IE-SW-PL18MT-2GC14TX2SC firmware v3.4.4 Build 16102416 and prior IE-SW-PL18M-2GC14TX2ST firmware v3.4.4 Build 16102416 and prior IE-SW-PL18MT-2GC14TX2ST firmware v3.4.4 Build 16102416 and prior IE-SW-PL18M-2GC14TX2SCS firmware v3.4.4 Build 16102416 and prior IE-SW-PL18MT-2GC14TX2SCS firmware v3.4.4 Build 16102416 and prior IE-SW-PL09M-5GC-4GT firmware v3.3.4 Build 16102416 and prior IE-SW-PL09MT-5GC-4GT firmware v3.3.4 Build 16102416 and prior.,CVE-2019-16670; CVE-2019-16671; CVE-2019-16672; CVE-2019-16673 CVE-2019-16674,9.8,Critical,CWE-307; CWE-311; CWE-341; CWE-400; CWE-256,Critical Manufacturing; Information Technology,Worldwide,Germany
1205,12/3/2019,No Updates,2019,ICSA-19-337-01,Reliable Controls LicenseManager,Reliable Controls,LicenseManager,RC-LicenseManager: Versions 3.4 and prior.,CVE-2019-18245,7.8,High,CWE-428,Commercial Facilities; Critical Manufacturing; Government Facilities,Worldwide,Canada
1204,12/3/2019,No Updates,2019,ICSA-19-337-02,Moxa AWK-3121,Moxa,AWK-3121,AWK-3121: All Versions 1.14 and prior.,CVE-2018-10690; CVE-2018-10691; CVE-2018-10692; CVE-2018-10693; CVE-2018-10694; CVE-2018-10695; CVE-2018-10696; CVE-2018-10697; CVE-2018-10698; CVE-2018-10699; CVE-2018-10700; CVE-2018-10701; CVE-2018-10702; CVE-2018-10703,9.8,Critical,CWE-284; CWE-319; CWE-1004; CWE-119; CWE-352; CWE-77; CWE-79,Critical Manufacturing; Energy; Water and Wastewater,Worldwide,Taiwan
1203,11/26/2019,No Updates,2019,ICSA-19-330-01,ABB Relion 670 Series,ABB,Relion 670 Series,Relion 670 series versions 1p1r26 and prior Relion 670 series versions 1.2.3.17 and prior Relion 670 series versions 2.0.0.10 and prior (RES670 2.0.0.4 and prior) Relion 670 series versions 2.1.0.1 and prior.,CVE-2019-18253,10,Critical,CWE-22,Critical Manufacturing; Energy,Worldwide,Switzerland
1202,11/26/2019,No Updates,2019,ICSA-19-330-02,ABB Relion 650 and 670 Series,ABB,Relion 650 and 670 Series,Relion 650 series versions 1.3.0.5 and prior Relion 670 series versions 1.2.3.18 and prior Relion 670 series versions 2.0.0.11 and prior Relion 670 series versions 2.1.0.1 and prior.,CVE-2019-18247,5.3,Medium,CWE-20,Critical Manufacturing; Energy,Worldwide,Switzerland
1201,11/19/2019,No Updates,2019,ICSA-19-323-01,Flexera FlexNet Publisher,Flexera,FlexNet Publisher,FlexNet Publisher Version 2018 R3 and prior.,CVE-2018-20031; CVE-2018-20032; CVE-2018-20033; CVE-2018-20034,9.8,Critical,CWE-20; CWE-119,Information Technology,Worldwide,United States
1200,11/14/2019,No Updates,2019,ICSA-19-318-01,Siemens Mentor Nucleus Networking Module,Siemens,Mentor Nucleus Networking Module,"Nucleus NET: All versions Nucleus RTOS: All versions Nucleus ReadyStart for ARM, MIPS, and PPC: All versions prior to v2017.02.2 with patch “Nucleus 2017.02.02 Nucleus NET Patch” Nucleus SafetyCert: All versions Nucleus Source Code: All versions VSTAR: All versions.",CVE-2019-13939,7.1,High,CWE-20,Critical Manufacturing,Worldwide,Germany
1199,11/14/2019,No Updates,2019,ICSA-19-318-03,Siemens Desigo PX Devices,Siemens,Desigo PX Devices,"Desigo PX automation controllers are affected: PXC00-E.D, PXC50-E.D, PXC100-E.D, PXC200-E.D with Desigo PX Web modules PXA40-W0, PXA40-W1, PXA40-W2: All firmware versions prior to V6.00.320 PXC00-U, PXC64-U, PXC128-U with Desigo PX Web modules PXA30-W0, PXA30-W1, PXA30-W2: All firmware versions prior to V6.00.320 PXC22.1-E.D, PXC36-E.D, PXC36.1-E.D with activated web server: All firmware versions prior to V6.00.320.",CVE-2019-13927,5.3,Medium,CWE-472,Chemical; Critical Manufacturing; Energy; Food and Agriculture; Water and Wastewater,Worldwide,Germany
1198,11/14/2019,No Updates,2019,ICSA-19-318-05,ABB Power Generation Information Manager (PGIM) and Plant Connect,ABB,Power Generation Information Manager (PGIM) and Plant Connect,Power Generation Information Manager (PGIM): All versions Plant Connect: All versions.,CVE-2019-18250,9.8,Critical,CWE-288,Chemical; Critical Manufacturing; Dams; Energy; Food and Agriculture; Water and Wastewater,Worldwide,Switzerland
1197,11/7/2019,No Updates,2019,ICSMA-19-120-01,Philips Tasy EMR (Update A),Philips,Tasy EMR,Tasy EMR Versions 3.02.1744 and prior Tasy WebPortal Versions 3.02.1757 and prior.,CVE-2019-6562; CVE-2019-13557,4.3,Medium,CWE-200; CWE-79,Healthcare and Public Health,Brazil Mexico,Netherlands
1196,11/7/2019,No Updates,2019,ICSMA-19-311-01,Medtronic Valleylab FT10 and LS10,Medtronic,Valleylab FT10 and LS10,Medtronic Valleylab energy and electrosurgery products affected: Valleylab FT10 Energy Platform (VLFT10GEN) Version 2.1.0 and lower Version 2.0.3 and lower Valleylab LS10 Energy Platform (VLLS10GEN—not available in the United States) Version 1.20.2 and lower.,CVE-2019-13531; CVE-2019-13535,4.8,Medium,CWE-287; CWE-693,Healthcare and Public Health,Worldwide,Ireland
1195,11/7/2019,No Updates,2019,ICSMA-19-311-02,Medtronic Valleylab FT10 and FX8,Medtronic,Valleylab FT10 and FX8,"Medtronic Valleylab energy products affected: Valleylab Exchange Client, Version 3.4 and below Valleylab FT10 Energy Platform (VLFT10GEN) software Version 4.0.0 and below Valleylab FX8 Energy Platform (VLFX8GEN) software Version 1.1.0 and below.",CVE-2019-13539; CVE-2019-13543; CVE-2019-3463; CVE-2019-3464,9.8,Critical,CWE-20; CWE-328; CWE-798,Healthcare and Public Health,Worldwide,Ireland
1194,11/7/2019,No Updates,2019,ICSA-19-311-01,Mitsubishi Electric MELSEC-Q Series and MELSEC-L Series CPU Modules,Mitsubishi Electric,MELSEC-Q Series and MELSEC-L Series CPU Modules,"[MELSEC-Q Series] Q03/04/06/13/26UDVCPU: serial number 21081 and prior, Q04/06/13/26UDPVCPU: serial number 21081 and prior, and Q03UDECPU, Q04/06/10/13/20/26/50/100UDEHCPU: serial number 21081 and prior. [MELSEC-L Series] L02/06/26CPU, L26CPU-BT: serial number 21101 and prior, L02/06/26CPU-P, L26CPU-PBT: serial number 21101 and prior, and L02/06/26CPU-CM, L26CPU-BT-CM: serial number 21101 and prior.",CVE-2019-13555,7.5,High,CWE-400,Critical Manufacturing,Worldwide,Japan
1193,11/7/2019,No Updates,2019,ICSA-19-311-02,Fuji Electric V-Server,Fuji Electric,V-Server,V-Server - data collection and management service versions affected: V-Server 4.0.6 and prior.,CVE-2019-18240,7.8,High,CWE-122,Critical Manufacturing,Worldwide,Japan
1192,11/5/2019,11/6/2019,2019,ICSA-19-309-01,Omron CX-Supervisor,Omron,CX-Supervisor,Full Development and Runtime Only packages of Omron's SCADA and HMI package CX-Supervisor versions affected: CX-Supervisor Versions 3.5 (12) and prior.,CVE-2010-3128; CVE-2018-14333; CVE-2018-16550; CVE-2019-11769,9.8,Critical,CWE-477,Energy,Worldwide,Japan
1191,11/5/2019,No Updates,2019,ICSA-19-134-01,Omron Network Configurator for DeviceNet (Update A),Omron,Network Configurator for DeviceNet,Network Configurator for DeviceNet Safety 3.41 and prior.,CVE-2019-10971,7.3,High,CWE-426,Critical Manufacturing,Worldwide,Japan
1190,10/31/2019,No Updates,2019,ICSA-19-304-01,Advantech WISE-PaaS/RMM,Advantech,WISE-PaaS/RMM,Versions of WISE-PaaS/RMM - IoT device remote monitoring and management platform are affected: WISE-PaaS/RMM Versions 3.3.29 and prior.,CVE-2019-13547; CVE-2019-13551; CVE-2019-18227; CVE-2019-18229,9.8,Critical,CWE-22; CWE-89; CWE-611; CWE-862,Critical Manufacturing; Energy Water,East Asia Europe United States,Taiwan
1189,10/31/2019,No Updates,2019,ICSA-19-304-02,Honeywell equIP Series IP Cameras,Honeywell,equIP Series IP Cameras,Honeywell equIP Series IP camera products and versions affected: H4L2GR1 2.420.HW01.33.20190812 | HBL2GR1 2.420.HW01.33.20190812 | HCL2G 2.420.HW01.33.20190812 | H4W2GR1 1.000.HW00.21.20190812 | H4W2GR2 1.000.HW00.21.20190812  H4W4GR1 1.000.HW00.21.20190812 | H3W2GR2 1.000.HW00.21.20190812 | H3W4GR1 1.000.HW00.21.20190812 | HBW2GR1 1.000.HW00.21.20190812 | HBW4GR1 1.000.HW00.21.20190812 | HBW2GR3 1.000.HW00.21.20190812 | HCW2G 1.000.HW00.21.20190812 | HCW4G 1.000.HW00.21.20190812.,CVE-2019-18228,7.5,High,CWE-20,Commercial Facilities; Critical Manufacturing; Energy; Healthcare and Public Health,Worldwide,United States
1188,10/31/2019,No Updates,2019,ICSA-19-304-03,Honeywell equIP and Performance Series IP Cameras,Honeywell,equIP and Performance Series IP Cameras,equIP Series Cameras and versions affected: H2W2GR1 1.000.0000.18.20190409 | H3W2GR1 1.000.HW00.21.20190812 | * H3W2GR1V 1.000.0000.18.20190409 | H3W2GR2 1.000.HW00.21.20190812 | H3W4GR1 1.000.HW00.21.20190812 | * H3W4GR1V 1.000.0000.18.20190409 | * H4D8GR1 2.420.HW00.9.20180510 | H4L2GR1 1.000.0000.18.20190423 | * H4L2GR1V 1.000.0000.18.20190423 | H4L6GR2 1.000.HW02.8.20190813 | H4LGGR2 1.000.HW04.3.20190813 | H4W2GR1 1.000.HW00.21.20190812 | * H4W2GR1V 1.000.0000.18.20190409 | H4W2GR2 1.000.HW00.21.20190812 | H4W4GR1 1.000.HW00.21.20190812 | * H4W4GR1V 1.000.0000.18.20190409 | * HBD8GR1 2.420.HW00.9.20180510 | HBL2GR1 2.420.HW01.33.20190812 | * HBL2GR1V 1.000.0000.18.20190423 | HBL6GR2 1.000.HW04.3.20190813 | HBL6GR2 1.000.HW02.8.20190813 | HBW2GR1 1.000.HW00.21.20190812 | * HBW2GR1V 1.000.0000.18.20190409 | HBW2GR3 1.000.HW00.21.20190812 | * HBW2GR3V 1.000.0000.18.20190409 | HBW4GR1 1.000.HW00.21.20190812 | * HBW4GR1V 1.000.0000.18.20190409 | * HCD8G 2.420.HW00.9.20180510 | HCL2G 1.000.0000.18.20190423 | * HCL2GV 1.000.0000.18.20190423 | HCW2G 1.000.HW00.21.20190812 | * HCW2GV 1.000.0000.18.20190409 | HCW4G 1.000.HW00.21.20190812 | * HDZ302D 1.000.0041.20180530 | * HDZ302DE 1.000.0041.20180530 | * HDZ302DIN 1.000.0041.20180530 | * HDZ302DIN-C1 1.000.0041.20180530 | * HDZ302DIN-S1 1.000.0041.20180530 | * HDZ302LIK 1.000.61.1.20180607 | * HDZ302LIW 1.000.61.1.20180607 | * HFD6GR1 1.000.HW00.9.20180510 | * HFD8GR1 1.000.HW00.9.20180510 | HM4L8GR1 1.000.HW02.8.20190813 | HMBL8GR1 1.000.HW02.8.20190813. Performance Series Cameras and versions affected: H4D8PR1 1.000.HW01.3.20190820 | HFD5PR1 1.000.HW01.1.20190822 | HPW2P1 1.000.HW01.3.20190820 | * HDZP304DI 1.000.HW10.5.20190812 | * HDZP252DI 1.000.HW02.3.20181109.,CVE-2019-18230,7.5,High,CWE-306,Commercial Facilities; Critical Manufacturing; Energy; Healthcare and Public Health,Worldwide,United States
